[
  {
    "id": "agente-pop-alm-01",
    "codigo": "ALM-01",
    "pop_id": "pop-alm-01",
    "nome": "Agente do processo ALM-01 — Recebimento de Materiais",
    "setor_codigo": "S03.04-ALM",
    "arquivo": ".claude/agents/pop-alm-01.md",
    "versao_diretrizes": "1.2",
    "versao_pop": "1.1.0",
    "modelo": "sonnet",
    "origem": "script",
    "criado_em": "2026-09-02T17:57:56Z",
    "atualizado_em": "2026-09-03T01:51:30Z"
  },
  {
    "id": "agente-pop-alm-00",
    "codigo": "ALM-00",
    "pop_id": "pop-alm-00",
    "nome": "Agente do processo ALM-00 — Visão geral — Div. de Almoxarifado",
    "setor_codigo": "S03.04-ALM",
    "arquivo": ".claude/agents/pop-alm-00.md",
    "versao_diretrizes": "1.2",
    "versao_pop": "1.0.0",
    "modelo": "sonnet",
    "origem": "script",
    "criado_em": "2026-09-03T01:51:30Z",
    "atualizado_em": "2026-09-03T01:51:30Z"
  },
  {
    "id": "agente-pop-alm-02",
    "codigo": "ALM-02",
    "pop_id": "pop-alm-02",
    "nome": "Agente do processo ALM-02 — Armazenagem",
    "setor_codigo": "S03.04-ALM",
    "arquivo": ".claude/agents/pop-alm-02.md",
    "versao_diretrizes": "1.2",
    "versao_pop": "1.0.0",
    "modelo": "sonnet",
    "origem": "script",
    "criado_em": "2026-09-03T01:51:30Z",
    "atualizado_em": "2026-09-03T01:51:30Z"
  },
  {
    "id": "agente-pop-alm-03",
    "codigo": "ALM-03",
    "pop_id": "pop-alm-03",
    "nome": "Agente do processo ALM-03 — Distribuição para Departamentos",
    "setor_codigo": "S03.04-ALM",
    "arquivo": ".claude/agents/pop-alm-03.md",
    "versao_diretrizes": "1.2",
    "versao_pop": "1.0.0",
    "modelo": "sonnet",
    "origem": "script",
    "criado_em": "2026-09-03T01:51:30Z",
    "atualizado_em": "2026-09-03T01:51:30Z"
  },
  {
    "id": "agente-pop-alm-04",
    "codigo": "ALM-04",
    "pop_id": "pop-alm-04",
    "nome": "Agente do processo ALM-04 — Inventário Rotativo",
    "setor_codigo": "S03.04-ALM",
    "arquivo": ".claude/agents/pop-alm-04.md",
    "versao_diretrizes": "1.2",
    "versao_pop": "1.0.0",
    "modelo": "sonnet",
    "origem": "script",
    "criado_em": "2026-09-03T01:51:30Z",
    "atualizado_em": "2026-09-03T01:51:30Z"
  },
  {
    "id": "agente-pop-alm-05",
    "codigo": "ALM-05",
    "pop_id": "pop-alm-05",
    "nome": "Agente do processo ALM-05 — Inventário Geral",
    "setor_codigo": "S03.04-ALM",
    "arquivo": ".claude/agents/pop-alm-05.md",
    "versao_diretrizes": "1.2",
    "versao_pop": "1.0.0",
    "modelo": "sonnet",
    "origem": "script",
    "criado_em": "2026-09-03T01:51:30Z",
    "atualizado_em": "2026-09-03T01:51:30Z"
  },
  {
    "id": "agente-pop-alm-06",
    "codigo": "ALM-06",
    "pop_id": "pop-alm-06",
    "nome": "Agente do processo ALM-06 — Conciliação Físico-Contábil",
    "setor_codigo": "S03.04-ALM",
    "arquivo": ".claude/agents/pop-alm-06.md",
    "versao_diretrizes": "1.2",
    "versao_pop": "1.0.0",
    "modelo": "sonnet",
    "origem": "script",
    "criado_em": "2026-09-03T01:51:30Z",
    "atualizado_em": "2026-09-03T01:51:30Z"
  },
  {
    "id": "agente-pop-alm-07",
    "codigo": "ALM-07",
    "pop_id": "pop-alm-07",
    "nome": "Agente do processo ALM-07 — Desfazimento de Materiais Inservíveis",
    "setor_codigo": "S03.04-ALM",
    "arquivo": ".claude/agents/pop-alm-07.md",
    "versao_diretrizes": "1.2",
    "versao_pop": "1.0.0",
    "modelo": "sonnet",
    "origem": "script",
    "criado_em": "2026-09-03T01:51:30Z",
    "atualizado_em": "2026-09-03T01:51:30Z"
  },
  {
    "id": "agente-pop-alm-08",
    "codigo": "ALM-08",
    "pop_id": "pop-alm-08",
    "nome": "Agente do processo ALM-08 — Relatórios e Prestação de Contas",
    "setor_codigo": "S03.04-ALM",
    "arquivo": ".claude/agents/pop-alm-08.md",
    "versao_diretrizes": "1.2",
    "versao_pop": "1.0.0",
    "modelo": "sonnet",
    "origem": "script",
    "criado_em": "2026-09-03T01:51:30Z",
    "atualizado_em": "2026-09-03T01:51:30Z"
  }
]
